{
  "protocol_version": "0.1.0",
  "grant_id": "00000000-0000-4000-8000-000000000004",
  "recipient_id": "00000000-0000-4000-8000-000000000001",
  "device_binding_id": "00000000-0000-4000-8000-000000000005",
  "user_binding_id": "00000000-0000-4000-8000-000000000006",
  "scope_revision": 1,
  "state": "active",
  "created_at": "2026-10-03T00:00:00.000Z",
  "approved_at": "2026-10-03T00:00:00.000Z",
  "expires_at": "2026-10-04T00:00:00.000Z",
  "scope": {
    "applications": [
      {
        "namespace": "android",
        "id": "com.example.reader"
      },
      {
        "namespace": "android",
        "id": "com.example.video"
      }
    ],
    "allowed_fields": [
      "foreground_duration_ms"
    ],
    "event_names": [
      "activity.summary"
    ],
    "aggregation_interval_ms": 900000,
    "history_max_age_ms": 86400000,
    "history_max_bytes": 4194304
  }
}
